{
  "id": "auth_006_signout_during_active_bindings",
  "title": "Sign-out during an outstanding refresh clears projections and dominates the stale result",
  "initial_state": {
    "auth_state": "Authenticated",
    "canonical_version": 1,
    "pending_refresh_version": 0,
    "live_bindings": {
      "Postgrest": true,
      "Realtime": true,
      "Storage": true,
      "Functions": true
    },
    "projected_versions": {
      "Postgrest": 1,
      "Realtime": 1,
      "Storage": 1,
      "Functions": 1
    }
  },
  "events": [
    { "type": "begin_refresh" },
    { "type": "sign_out" },
    { "type": "ignore_stale_refresh_result" }
  ],
  "expected": {
    "auth_state": "SignedOut",
    "canonical_version": 1,
    "pending_refresh_version": 0,
    "live_bindings": {
      "Postgrest": true,
      "Realtime": true,
      "Storage": true,
      "Functions": true
    },
    "projected_versions": {
      "Postgrest": 0,
      "Realtime": 0,
      "Storage": 0,
      "Functions": 0
    }
  },
  "invariants": [
    "INV-AU-002",
    "INV-AU-003",
    "INV-BD-001"
  ],
  "notes": "This is the key race scenario for sign-out versus an older in-flight refresh."
}
