{
  "id": "urls_002_hosted_in_project",
  "title": "Hosted `.supabase.in` project URL derives the same endpoint shape",
  "initial_state": {
    "base_url": "https://abc.supabase.in"
  },
  "events": [
    { "type": "derive_all_endpoints" }
  ],
  "expected": {
    "normalized_base_url": "https://abc.supabase.in",
    "auth_url": "https://abc.supabase.in/auth/v1",
    "rest_url": "https://abc.supabase.in/rest/v1",
    "realtime_url": "wss://abc.supabase.in/realtime/v1",
    "storage_url": "https://abc.supabase.in/storage/v1",
    "functions_url": "https://abc.supabase.in/functions/v1"
  },
  "invariants": [
    "INV-URL-001",
    "INV-URL-002"
  ],
  "notes": "Hosted regional variant should behave identically after normalization."
}
